{
  "v": 1,
  "type": "approval.request",
  "request_id": "10000000-0000-4000-8000-000000000001",
  "origin_id": "20000000-0000-4000-8000-000000000001",
  "job_id": "30000000-0000-4000-8000-000000000001",
  "run_id": "40000000-0000-4000-8000-000000000001",
  "created_at": "2026-09-07T09:00:00Z",
  "expires_at": "2026-09-07T09:05:00Z",
  "summary": "Push feature branch",
  "operation": {
    "schema": "exec.v1",
    "argv": ["/usr/bin/git", "push", "origin", "feature/watch-controls"],
    "cwd": "/srv/work/shell",
    "context_sha256": "0123456789abcdef0123456789abcdef0123456789abcdef0123456789abcdef"
  },
  "minimum_review": "watch",
  "allowed_decisions": ["approve", "reject"],
  "required_features": ["exec.v1", "consume.v1"]
}
